{
  "schema_version": "shoplift.risk_event.v1",
  "event_id": "evt-demo-0001",
  "camera_id": "demo-camera-001",
  "timestamp_ms": 12400,
  "start_timestamp_ms": 9200,
  "end_timestamp_ms": 12400,
  "person_track_id": "person-7",
  "event_type": "bag_concealment",
  "risk_score": 0.82,
  "risk_level": "high",
  "confidence": 0.76,
  "reason_tags": [
    "hand_item_contact",
    "entered_private_container",
    "after_private_container_entry",
    "item_disappeared"
  ],
  "evidence": [
    {
      "relation_type": "hand_item_contact",
      "frame_id": 276,
      "timestamp_ms": 9200,
      "score": 0.71,
      "reason_tags": [
        "hand_item_overlap",
        "temporal_consistent",
        "motion_aligned"
      ],
      "person_track_id": "person-7",
      "hand_track_id": "hand-7-right",
      "item_track_id": "item-34",
      "container_track_id": null,
      "evidence_boxes": {
        "hand": [430.0, 318.0, 474.0, 364.0],
        "item": [452.0, 330.0, 490.0, 374.0]
      },
      "metadata": {
        "continuous_frames": 5
      }
    },
    {
      "relation_type": "item_enter_container",
      "frame_id": 368,
      "timestamp_ms": 12266,
      "score": 0.84,
      "reason_tags": [
        "entered_private_container",
        "entry_temporal_consistent"
      ],
      "person_track_id": "person-7",
      "hand_track_id": "hand-7-right",
      "item_track_id": "item-34",
      "container_track_id": "bag-7",
      "evidence_boxes": {
        "item": [464.0, 352.0, 492.0, 380.0],
        "container": [488.0, 318.0, 578.0, 452.0]
      },
      "metadata": {
        "container_kind": "private",
        "container_type": "handbag"
      }
    },
    {
      "relation_type": "item_disappeared_after_entry",
      "frame_id": 372,
      "timestamp_ms": 12400,
      "score": 0.89,
      "reason_tags": [
        "item_disappeared",
        "after_container_entry",
        "after_private_container_entry"
      ],
      "person_track_id": "person-7",
      "hand_track_id": null,
      "item_track_id": "item-34",
      "container_track_id": "bag-7",
      "evidence_boxes": {
        "item": [464.0, 352.0, 492.0, 380.0],
        "container": [488.0, 318.0, 578.0, 452.0]
      },
      "metadata": {
        "missing_frames": 10,
        "container_kind": "private"
      }
    }
  ],
  "clip_uri": null,
  "debug_visualization_uri": "./outputs/shoplift/debug/evt-demo-0001.mp4",
  "metadata": {
    "note": "Example for schema validation only; not an automatic theft determination."
  }
}
